{
  "$schema": "./omp-runtime-lock.schema.json",
  "repository": "can1357/oh-my-pi",
  "version": "18.1.13",
  "checksumAsset": "SHA256SUMS.txt",
  "assets": {
    "win32-x64": {
      "name": "omp-windows-x64.exe",
      "sha256": "5d75a584acd1d8775d2ea6a14c3ea0dbdf8eb71a54bdab6ae7f38ab971aef877"
    }
  }
}
